{
  "schema_version": "2.0.0",
  "source_native_provenance": {
    "originating_repository": "https://github.com/Neuronautix/ComputationalReviewTemplate_trust-knowledge",
    "rubric_version": "2.0.0",
    "method_version": "trust-validator-2.0.0",
    "semantic_origin": "source_native_trust",
    "oratlas_re_adjudicated": false,
    "assessment_unit": { "decision_id": "D01", "status": "proposed", "projection": "claim_object_current_behavior" },
    "disagreement": { "decision_id": "D09", "status": "proposed", "representation": "not_available", "aggregation_performed": false },
    "export_semantics": { "decision_id": "D11", "status": "proposed" }
  },
  "rubric_version": "2.0.0",
  "generated_at": "2026-07-01T11:55:00Z",
  "release_id": "release-example-v1-1-0",
  "claims": [
    {
      "claim_id": "clm_bbbbbbbbbbbbbbbb",
      "component_scores": {
        "traceability": 4,
        "robustness": 4,
        "uncertainty_calibration": 4,
        "source_integrity": 4,
        "transferability_scope_control": 4
      },
      "overall_score": 100,
      "trust_label": "high_trust"
    },
    {
      "claim_id": "clm_dddddddddddddddd",
      "component_scores": {
        "traceability": 4,
        "robustness": 3,
        "uncertainty_calibration": 4,
        "source_integrity": 4,
        "transferability_scope_control": 4
      },
      "overall_score": 95,
      "trust_label": "high_trust"
    },
    {
      "claim_id": "clm_eeeeeeeeeeeeeeee",
      "component_scores": {
        "traceability": 4,
        "robustness": 4,
        "uncertainty_calibration": 4,
        "source_integrity": 4,
        "transferability_scope_control": 4
      },
      "overall_score": 100,
      "trust_label": "high_trust"
    }
  ]
}
